{
 "format": "spyder-bone/engine_check",
 "format_version": 1,
 "check": "zooms_patterns",
 "id": "check.zooms_patterns",
 "version": "2.0.0",
 "engine_min": "1.1",
 "status": "active",
 "title": "ZooMS band pattern (A-E) and its verdict",
 "description": "Six collagen-associated bands (bands.json): protein-type N-H 2044 and amide 2175; the other four (parameter ch_bands, an id): C-H 1689 and 1728, protein O-H 2262 (hydroxyproline O-H and bound water) and amide III + CH2 2284, read on the evidence kernel. Lit = E_b > lit_if_E_above. Readable unless sd_E > sd_max_frac_w x w_b and E_b < unreadable_only_if_E_below_frac_w x w_b (sd_E = keyed band gain x N2 of the band's noise window, as measured). Pattern A all flat; B both protein bands flat; C one protein band lit; D both protein lit, another band flat; E all six lit. Verdict: Unlikely = both protein bands readable and flat; Good = all six readable and lit; Borderline = both protein bands readable and either exactly one lit, or both lit with a readable other band flat; Can't tell = anything else. Pattern letters are internal; the UI says it in words. Vote: after the pattern verdict, an Unlikely becomes Borderline when the vote band (the OH-corrected 1545 nm trough) is readable (unless sd_u > sd_max_frac_w and u < unreadable_only_if_E_below_frac_w, in u = u_sign x E / w) and u > lit_if_u_above; Good and Can't tell are unchanged.",
 "licence": "CC-BY-4.0",
 "created": "2026-10-03",
 "provenance": {
  "basis": "Phase 0a A17 (band set chosen on the 140 Ryder et al. 2026 bones; no cut fitted). Pooled R140 + a clean independent site: Good 127 scans, 95% at >= 0.5% yield; Unlikely 27, none at >= 0.5% (bound 13%). Pattern D stays Borderline (DECISIONS 46).",
  "vote": "Phase 0c (DECISIONS 75): a lit OH-corrected 1545 nm trough (> 1.25 u) turns Unlikely into Borderline. Across 3,280 scans: 66 changes (19 flagged), none on true-zero archaeological bone, no reference bone with a yield >= 0.3% affected; 1.0 u would free true-zero bone, so the line stays at 1.25."
 },
 "parameters": {
  "kernel": {
   "absorbance_clip": 1e-06,
   "savgol": {
    "window": 31,
    "polyorder": 3,
    "deriv": 2,
    "delta": 1.0,
    "mode": "interp"
   },
   "scale": -100000.0
  },
  "protein_bands": [
   "NH2044",
   "AM2175"
  ],
  "ch_bands": [
   "CH1689",
   "CH1728",
   "CH2262",
   "CH2284"
  ],
  "lit_if_E_above": 0.0,
  "readability": {
   "sd_max_frac_w": 0.25,
   "unreadable_only_if_E_below_frac_w": 1.5
  },
  "vote": {
   "band": "NH1545c",
   "lit_if_u_above": 1.25,
   "from_verdict": "Unlikely",
   "to_verdict": "Borderline"
  },
  "patterns": {
   "A": "flat at all six",
   "B": "both protein bands flat (other bands only or isolated)",
   "C": "one protein band lit",
   "D": "both protein bands lit, another band flat",
   "E": "all six lit"
  },
  "verdicts": [
   "Unlikely",
   "Borderline",
   "Good",
   "Can't tell"
  ]
 },
 "golden": {
  "spectra_file": "golden_spectra_checks_v1.json",
  "tolerance": {
   "abs": 1e-09,
   "rel": 1e-09
  },
  "cases": [
   {
    "name": "rc_flat_none_low_m",
    "spectrum_sha256": "ef8ddf9e2c7d95bc6ca3d426aca0859ecb56e566fc930cb047d336251ebf75ea",
    "inputs": {
     "sd_E": {
      "AM2175": 0.03420185584992439,
      "CH1689": 0.019345506199095877,
      "CH1728": 0.021891118674307174,
      "CH2262": 0.03322667720171559,
      "CH2284": 0.04032597013706744,
      "NH1545c": 0.012727344493237749,
      "NH2044": 0.03420185584992439
     }
    },
    "expected": {
     "status": "assessed",
     "pattern": "A",
     "verdict": "Unlikely",
     "pattern_verdict": "Unlikely",
     "bands.NH2044.E": -1.6463560447242114,
     "bands.NH2044.lit": false,
     "bands.NH2044.readable": true,
     "bands.NH2044.sd_E": 0.03420185584992439,
     "bands.AM2175.E": -0.759554649876217,
     "bands.AM2175.lit": false,
     "bands.AM2175.readable": true,
     "bands.AM2175.sd_E": 0.03420185584992439,
     "bands.CH1689.E": -0.318030735873226,
     "bands.CH1689.lit": false,
     "bands.CH1689.readable": true,
     "bands.CH1689.sd_E": 0.019345506199095877,
     "bands.CH1728.E": -0.36117454540948507,
     "bands.CH1728.lit": false,
     "bands.CH1728.readable": true,
     "bands.CH1728.sd_E": 0.021891118674307174,
     "bands.CH2262.E": -0.7967160577950156,
     "bands.CH2262.lit": false,
     "bands.CH2262.readable": true,
     "bands.CH2262.sd_E": 0.03322667720171559,
     "bands.CH2284.E": -1.295948171175683,
     "bands.CH2284.lit": false,
     "bands.CH2284.readable": true,
     "bands.CH2284.sd_E": 0.04032597013706744,
     "vote_band.id": "NH1545c",
     "vote_band.E": -0.573485655594834,
     "vote_band.u": 0.9558094259913901,
     "vote_band.sd_u": 0.021212240822062915,
     "vote_band.readable": true,
     "vote_band.lit": false,
     "vote_1545": false
    }
   },
   {
    "name": "rc_good_positive_all_six",
    "spectrum_sha256": "ea4c88b7008cb8b19f102f52d39d19a2c4a0b1a93cda1f2e30545ecbdd6f407d",
    "inputs": {
     "sd_E": {
      "AM2175": 0.17510486755994908,
      "CH1689": 0.0742695364336214,
      "CH1728": 0.08404242407625244,
      "CH2262": 0.22943019018670174,
      "CH2284": 0.27845080450996557,
      "NH1545c": 0.04886168218167114,
      "NH2044": 0.17510486755994908
     }
    },
    "expected": {
     "status": "assessed",
     "pattern": "E",
     "verdict": "Good",
     "pattern_verdict": "Good",
     "bands.NH2044.E": 16.07168393065053,
     "bands.NH2044.lit": true,
     "bands.NH2044.readable": true,
     "bands.NH2044.sd_E": 0.17510486755994908,
     "bands.AM2175.E": 10.441046382642527,
     "bands.AM2175.lit": true,
     "bands.AM2175.readable": true,
     "bands.AM2175.sd_E": 0.17510486755994908,
     "bands.CH1689.E": 6.947031646489213,
     "bands.CH1689.lit": true,
     "bands.CH1689.readable": true,
     "bands.CH1689.sd_E": 0.0742695364336214,
     "bands.CH1728.E": 7.775438032989515,
     "bands.CH1728.lit": true,
     "bands.CH1728.readable": true,
     "bands.CH1728.sd_E": 0.08404242407625244,
     "bands.CH2262.E": 12.963465981256164,
     "bands.CH2262.lit": true,
     "bands.CH2262.readable": true,
     "bands.CH2262.sd_E": 0.22943019018670174,
     "bands.CH2284.E": 9.273209729825172,
     "bands.CH2284.lit": true,
     "bands.CH2284.readable": true,
     "bands.CH2284.sd_E": 0.27845080450996557,
     "vote_band.id": "NH1545c",
     "vote_band.E": -4.651582575859624,
     "vote_band.u": 7.7526376264327075,
     "vote_band.sd_u": 0.0814361369694519,
     "vote_band.readable": true,
     "vote_band.lit": true,
     "vote_1545": false
    }
   },
   {
    "name": "rc_positive_clear_m_1p5",
    "spectrum_sha256": "df01707d292ae7c83e2759d457a63f726b364d720cac43b3b55375e9c74e73b4",
    "inputs": {
     "sd_E": {
      "AM2175": 0.059383056164420106,
      "CH1689": 0.03518987515358242,
      "CH1728": 0.039820396798773285,
      "CH2262": 0.1388037973922439,
      "CH2284": 0.16846095547171286,
      "NH1545c": 0.023151302382286732,
      "NH2044": 0.059383056164420106
     }
    },
    "expected": {
     "status": "assessed",
     "pattern": "D",
     "verdict": "Borderline",
     "pattern_verdict": "Borderline",
     "bands.NH2044.E": 2.3155408962850528,
     "bands.NH2044.lit": true,
     "bands.NH2044.readable": true,
     "bands.NH2044.sd_E": 0.059383056164420106,
     "bands.AM2175.E": 2.30977127018158,
     "bands.AM2175.lit": true,
     "bands.AM2175.readable": true,
     "bands.AM2175.sd_E": 0.059383056164420106,
     "bands.CH1689.E": 1.7955005174944099,
     "bands.CH1689.lit": true,
     "bands.CH1689.readable": true,
     "bands.CH1689.sd_E": 0.03518987515358242,
     "bands.CH1728.E": 2.0336128124042743,
     "bands.CH1728.lit": true,
     "bands.CH1728.readable": true,
     "bands.CH1728.sd_E": 0.039820396798773285,
     "bands.CH2262.E": 2.9780027459142593,
     "bands.CH2262.lit": true,
     "bands.CH2262.readable": true,
     "bands.CH2262.sd_E": 0.1388037973922439,
     "bands.CH2284.E": -0.2999999999999314,
     "bands.CH2284.lit": false,
     "bands.CH2284.readable": true,
     "bands.CH2284.sd_E": 0.16846095547171286,
     "vote_band.id": "NH1545c",
     "vote_band.E": -1.4493512155804023,
     "vote_band.u": 2.4155853593006706,
     "vote_band.sd_u": 0.038585503970477886,
     "vote_band.readable": true,
     "vote_band.lit": true,
     "vote_1545": false
    }
   },
   {
    "name": "rc_s_null_bands_too_noisy",
    "spectrum_sha256": "a1e6c29ce88433b9a3c7682663096ebb7b244db34f7164aa59a4f9c2902eb5bb",
    "inputs": {
     "sd_E": {
      "AM2175": 0.9750950000002917,
      "CH1689": 1.0779200000005946,
      "CH1728": 1.2197600000006728,
      "CH2262": 1.037150000000124,
      "CH2284": 1.2587500000001504,
      "NH1545c": 0.7091600000003913,
      "NH2044": 0.9750950000002917
     }
    },
    "expected": {
     "status": "assessed",
     "pattern": "A",
     "verdict": "Can't tell",
     "pattern_verdict": "Can't tell",
     "bands.NH2044.E": -1.7201433449477679,
     "bands.NH2044.lit": false,
     "bands.NH2044.readable": false,
     "bands.NH2044.sd_E": 0.9750950000002917,
     "bands.AM2175.E": -0.759554649876217,
     "bands.AM2175.lit": false,
     "bands.AM2175.readable": false,
     "bands.AM2175.sd_E": 0.9750950000002917,
     "bands.CH1689.E": -0.318030735873226,
     "bands.CH1689.lit": false,
     "bands.CH1689.readable": false,
     "bands.CH1689.sd_E": 1.0779200000005946,
     "bands.CH1728.E": -0.36117454540948507,
     "bands.CH1728.lit": false,
     "bands.CH1728.readable": false,
     "bands.CH1728.sd_E": 1.2197600000006728,
     "bands.CH2262.E": -0.7915970082605699,
     "bands.CH2262.lit": false,
     "bands.CH2262.readable": false,
     "bands.CH2262.sd_E": 1.037150000000124,